{
  "$schema": "http://json-schema.org/draft-07/schema#",
  "title": "KB Routing Sessions Dataset",
  "description": "Multi-turn sessions for evaluating KB source selection in a multi-source agent.",
  "type": "array",
  "items": {
    "type": "object",
    "required": ["session_id", "session_type", "description", "n_turns", "turns"],
    "additionalProperties": false,
    "properties": {
      "session_id": {
        "type": "string",
        "description": "Unique identifier for the session."
      },
      "session_type": {
        "type": "string",
        "enum": ["DOCS", "RAG", "MIXED", "BOTH", "NONE"],
        "description": "Routing pattern for the session. DOCS = all turns expect the docs KB; RAG = all turns expect the resource backend; MIXED = turns route to different sources; BOTH = all turns accept either/both sources; NONE = no KB lookup expected for any turn."
      },
      "description": {
        "type": "string",
        "description": "Human-readable description of the session's intent and content."
      },
      "n_turns": {
        "type": "integer",
        "minimum": 1,
        "description": "Number of turns in this session. Must equal the length of the turns array."
      },
      "turns": {
        "type": "array",
        "minItems": 1,
        "items": {
          "type": "object",
          "required": ["id", "question", "expected", "persona"],
          "additionalProperties": false,
          "properties": {
            "id": {
              "type": "string",
              "description": "Unique turn identifier (UUID or slug)."
            },
            "question": {
              "type": "string",
              "description": "The user's question as it would appear in the chat."
            },
            "expected": {
              "type": "string",
              "enum": ["DOCS", "RAG", "BOTH", "REDIRECT", "NONE"],
              "description": "Which source(s) the agent should use. DOCS = documentation KB; RAG = resource-backend action groups (SQL or SPARQL); BOTH = either is acceptable or both should be used; REDIRECT = agent should navigate via redirect action; NONE = no KB lookup expected (agent should answer from general knowledge or decline)."
            },
            "persona": {
              "type": "string",
              "enum": ["CONTRIBUTOR", "REUSER", "FUNDER", "PATIENT", "X"],
              "description": "User persona for the question."
            },
            "notes": {
              "type": "string",
              "description": "Optional reasoning for why this question maps to the expected KB source, or edge-case notes."
            }
          }
        }
      }
    }
  }
}
