[
  {
    "session_id": "docs-registry-contribution",
    "session_type": "DOCS",
    "description": "How to submit a new standard, then which field records its responsible SDO",
    "n_turns": 2,
    "turns": [
      {
        "id": "docs-registry-contribution-t1",
        "question": "How do I submit a new data standard to the Bridge2AI Standards Explorer?",
        "expected": "DOCS",
        "persona": "CONTRIBUTOR",
        "notes": "Registry root page: submit by opening an issue on the Standards Registry GitHub repo using the provided form. QA dataset id 6bb1f136-d52f-4e0c-9979-defc32cd0e68."
      },
      {
        "id": "docs-registry-contribution-t2",
        "question": "Once it's in the registry, which field records the Standards Development Organization responsible for maintaining it?",
        "expected": "DOCS",
        "persona": "CONTRIBUTOR",
        "notes": "Curation Guide: the responsible_organization field on DataStandardOrTool.yaml. QA dataset id 09290084-1c35-457d-af0e-96851ba6a61d."
      }
    ]
  },
  {
    "session_id": "docs-curation-guide",
    "session_type": "DOCS",
    "description": "Curation Guide field for Grand Challenge relevance, then a GC short-name lookup",
    "n_turns": 2,
    "turns": [
      {
        "id": "docs-curation-guide-t1",
        "question": "If I want to record that a standard is used by a specific Bridge2AI Grand Challenge, which field in DataStandardOrTool.yaml do I edit?",
        "expected": "DOCS",
        "persona": "CONTRIBUTOR",
        "notes": "Curation Guide: has_relevant_organization field. QA dataset id a734aa80-9349-4aa5-8aa5-a96a689f641b."
      },
      {
        "id": "docs-curation-guide-t2",
        "question": "In the Curation Guide's table of Grand Challenges, what's the short name for the organization B2AI_ORG:117?",
        "expected": "DOCS",
        "persona": "FUNDER",
        "notes": "Curation Guide GC table: B2AI_ORG:117 = 'Precision Public Health' GC, short name 'Voice'. QA dataset id e1f6e9fb-a3af-4f18-97e3-e181e47cfcbd. Cross-checked live: organizations.id=B2AI_ORG:117 name is 'Precision Public Health Grand Challenge', and its D4D title is 'VOICE Dataset Documentation'."
      }
    ]
  },
  {
    "session_id": "docs-programmatic-access",
    "session_type": "DOCS",
    "description": "Which Synapse table holds data-format info, then whether reading it needs auth",
    "n_turns": 2,
    "turns": [
      {
        "id": "docs-programmatic-access-t1",
        "question": "Which Synapse table holds data formats and structures like JSON, CSV, and BIDS?",
        "expected": "DOCS",
        "persona": "CONTRIBUTOR",
        "notes": "Programmatic Access doc: DataSubstrate (syn63096834). QA dataset id 861df5b5-2350-4a53-ad90-6d7b7432a401."
      },
      {
        "id": "docs-programmatic-access-t2",
        "question": "Do I need an API key or a Synapse account just to read from that table via the REST API?",
        "expected": "DOCS",
        "persona": "CONTRIBUTOR",
        "notes": "Programmatic Access doc: all data tables are public, no API key/auth needed for read access. QA dataset id aabb3b2e-5fa7-4e0e-ad2a-ea60eb83254c."
      }
    ]
  },
  {
    "session_id": "docs-ai-access-mcp",
    "session_type": "DOCS",
    "description": "MCP server API-key requirement, then which MCP tool to use for a topic search",
    "n_turns": 2,
    "turns": [
      {
        "id": "docs-ai-access-mcp-t1",
        "question": "Does the Bridge2AI Standards Explorer MCP Server require an API key to use?",
        "expected": "DOCS",
        "persona": "REUSER",
        "notes": "AI Access doc: no API key required. QA dataset id 8f543b9c-2e8d-434e-bae0-814c3249eb0e."
      },
      {
        "id": "docs-ai-access-mcp-t2",
        "question": "If I want to find all standards tied to a topic like Genomics through the MCP, which built-in tool should I call?",
        "expected": "DOCS",
        "persona": "REUSER",
        "notes": "AI Access doc: search_by_topic tool, parameter topic_name. QA dataset id 53c1e382-39d4-481d-befa-2d06d080c2c0."
      }
    ]
  },
  {
    "session_id": "docs-categories",
    "session_type": "DOCS",
    "description": "Model Repository vs. Registry definitions, then a classification-tag lookup",
    "n_turns": 2,
    "turns": [
      {
        "id": "docs-categories-t1",
        "question": "What's the difference between a 'Model Repository' and a 'Registry' category on the Standards Explorer?",
        "expected": "DOCS",
        "persona": "CONTRIBUTOR",
        "notes": "Categories page: a Model Repository must provide storage so users can retrieve models; a Registry may only index them. QA dataset id 9e170515-0988-4865-8208-adf95a3e84c1."
      },
      {
        "id": "docs-categories-t2",
        "question": "Which classification tag would most likely apply to a standard or dataset of recorded speech?",
        "expected": "DOCS",
        "persona": "REUSER",
        "notes": "Categories page: 'speechdata' tag. QA dataset id b27922a3-be0c-4eea-9396-31592de0bad2."
      }
    ]
  },
  {
    "session_id": "docs-data-model-classes",
    "session_type": "DOCS",
    "description": "LinkML schema questions: OntologyOrVocabulary, DataStandardOrTool subclasses, Organization's own id fields",
    "n_turns": 3,
    "turns": [
      {
        "id": "docs-data-model-classes-t1",
        "question": "In the Bridge2AI standards schema, what's the 'OntologyOrVocabulary' class, and what is it a direct subclass of?",
        "expected": "DOCS",
        "persona": "REUSER",
        "notes": "standards-schemas OntologyOrVocabulary page: a set of concepts/categories, potentially with hierarchical relationships; direct subclass of DataStandardOrTool. QA dataset id a93b16d9-ea53-4dd9-864c-f99972e8bb37."
      },
      {
        "id": "docs-data-model-classes-t2",
        "question": "Is 'AnatomicalEntity' listed as one of DataStandardOrTool's direct subclasses in that schema?",
        "expected": "DOCS",
        "persona": "CONTRIBUTOR",
        "notes": "standards-schemas DataStandardOrTool page: direct subclasses are DataStandard, Registry, OntologyOrVocabulary, ModelRepository, SoftwareOrTool, ReferenceImplementation, TrainingProgram -- AnatomicalEntity is NOT among them. QA dataset id 755f4daa-1f43-4306-b066-516c66b09f56."
      },
      {
        "id": "docs-data-model-classes-t3",
        "question": "Which identifier fields belong directly to the Organization class rather than being inherited from NamedThing?",
        "expected": "DOCS",
        "persona": "CONTRIBUTOR",
        "notes": "standards-schemas Organization page: ror_id and wikidata_id are direct (not inherited). QA dataset id d4cf60de-87f7-4397-81f5-71207422cb30."
      }
    ]
  },
  {
    "session_id": "rag-standards-by-category",
    "session_type": "RAG",
    "description": "Live category count, then a live filtered count within that category",
    "n_turns": 2,
    "turns": [
      {
        "id": "rag-standards-by-category-t1",
        "question": "How many standards or tools are catalogued under the 'Ontology or Vocabulary' category?",
        "expected": "RAG",
        "persona": "REUSER",
        "notes": "Live sqlQuery on standards WHERE category='Ontology or Vocabulary': 179 rows (verified live, category breakdown also includes Biomedical Standard 326, Data Standard 105, Software or Tool 161, Training Program 223, Registry 19, Model Repository 7, Data Standard or Tool 9)."
      },
      {
        "id": "rag-standards-by-category-t2",
        "question": "Of those, how many are actually flagged as used in Bridge2AI itself?",
        "expected": "RAG",
        "persona": "REUSER",
        "notes": "Live sqlQuery on standards WHERE category='Ontology or Vocabulary' AND usedInBridge2AI='Yes': 7 rows (e.g. Current Procedural Terminology, LOINC, UMLS Metathesaurus). usedInBridge2AI is a 'Yes'/'No' string flag, not boolean."
      }
    ]
  },
  {
    "session_id": "rag-org-lookup",
    "session_type": "RAG",
    "description": "Names of the four Grand Challenge orgs, then a total organization count",
    "n_turns": 2,
    "turns": [
      {
        "id": "rag-org-lookup-t1",
        "question": "What are the names of the four Bridge2AI Grand Challenge organizations?",
        "expected": "RAG",
        "persona": "FUNDER",
        "notes": "Live sqlQuery on organizations WHERE id IN (B2AI_ORG:114..117): Salutogenesis GC, AI/ML for Clinical Care GC, Functional Genomics GC, Precision Public Health GC."
      },
      {
        "id": "rag-org-lookup-t2",
        "question": "How many organizations total are indexed on the portal?",
        "expected": "RAG",
        "persona": "FUNDER",
        "notes": "Live countByType: organizations = 130 (pinned)."
      }
    ]
  },
  {
    "session_id": "rag-topic-standards",
    "session_type": "RAG",
    "description": "Live counts of standards tagged with two different data topics",
    "n_turns": 2,
    "turns": [
      {
        "id": "rag-topic-standards-t1",
        "question": "How many standards are tagged with the 'Genome' data topic?",
        "expected": "RAG",
        "persona": "REUSER",
        "notes": "Live sqlQuery on standards WHERE topic HAS ('Genome'): 54 rows. topics.name for B2AI_TOPIC:13 is 'Genome'."
      },
      {
        "id": "rag-topic-standards-t2",
        "question": "And how many are tagged with 'Voice'?",
        "expected": "RAG",
        "persona": "REUSER",
        "notes": "Live sqlQuery on standards WHERE topic HAS ('Voice'): 18 rows."
      }
    ]
  },
  {
    "session_id": "rag-dataset-listing",
    "session_type": "RAG",
    "description": "A short list of datasets on a topic, then the total dataset count",
    "n_turns": 2,
    "turns": [
      {
        "id": "rag-dataset-listing-t1",
        "question": "Can you list a few datasets tagged with the Voice topic?",
        "expected": "RAG",
        "persona": "REUSER",